{
  "schema_version": "1.0",
  "unit_id": "ma-g4-tech-cs-u03",
  "source_course_id": "ma-g4-tech-cs",
  "subject": "technology",
  "band": "g3-4",
  "grade": 4,
  "grade_dir": "grade-04",
  "unit_number": 3,
  "unit_title": "Productivity and Collaboration Tools",
  "task_type": "interface_and_accessibility",
  "task_label": "Interface and accessibility task",
  "essential_question": "How can understanding productivity and collaboration tools help us explain, decide, create, or solve something that matters?",
  "standards": [
    "Michigan Computer Science: Computing Systems",
    "Michigan Computer Science: Data and Analysis"
  ],
  "estimated_days": 6,
  "project_brief": "Create an accessible one-page document or short slide set on a class topic. This is the grade 4 culminating project for \"Productivity and Collaboration Tools\" (ma-g4-tech-cs-u03, unit 3), built around efficient typing practice, formatting a document, building a simple slide, using accessibility features, and adding a comment or suggestion. Build the interface or artifact described in this unit's project so that it stays usable with efficient typing practice, formatting a document, building a simple slide, and using accessibility features, then run a short accessibility check against it and record one thing you changed as a result.",
  "requirements": [
    "Address every topic listed for this unit: efficient typing practice, formatting a document, building a simple slide, using accessibility features, adding a comment or suggestion, and keeping file versions organized.",
    "Meet the performance task as written: Create an accessible one-page document or short slide set on a class topic.",
    "Show your work or process, not just a final result — a process note, sketch log, commit history, or draft trail.",
    "Complete the checklist in this package before submitting."
  ],
  "primary_task": "Build the interface or artifact described in this unit's project so that it stays usable with efficient typing practice, formatting a document, building a simple slide, and using accessibility features, then run a short accessibility check against it and record one thing you changed as a result.",
  "test_or_check_criteria": [
    "Every claim or design choice in the submission can be traced to efficient typing practice or another named topic from this unit — nothing is left unexplained.",
    "The submission runs, displays, or demonstrates correctly on at least two different sample inputs or scenarios the student chooses.",
    "No real password, API key, account credential, precise location, or other real personal/system data appears anywhere in the submission — fictional or sandbox examples only.",
    "The student can explain, in their own words, why each step or decision was made, not just that it works.",
    "Every interactive element is reachable and usable without a mouse, and every image or icon has a text alternative."
  ],
  "presentation_and_privacy": {
    "sandbox_and_credentials_note": "This project never touches a real account, a real password or API key, a live production system, or another person's real data. Use fictional names, sandbox environments, local files, or already-approved sample data throughout. Submit code, screenshots of your own sandbox, diagrams, or a written walkthrough — a live public deployment is never required."
  },
  "copyright_and_authorship": "The final submitted work must remain your own authorship. A parent, tutor, or AI assistant may help you plan, explain a concept, demonstrate a technique, or give feedback on a draft, but may not produce the graded work itself. Never request, store, or submit a real password, API key, access token, or other real credential; use only fictional accounts and sandboxed or offline systems.",
  "remediation": "If the project stalls, step back to the smallest version of the task: rebuild just the part covering efficient typing practice in isolation, using a worked example from this unit as a model, then re-attach it to the full project once that smaller piece works and you can explain why.",
  "extension": "Once the core project is working, extend it to handle a new constraint or edge case related to formatting a document, or compare two different approaches to the same problem and explain the real tradeoff between them in your own words."
}
