{
  "schema_version": "1.0",
  "unit_id": "ma-g7-technology-u06",
  "source_course_id": "ma-g7-technology",
  "subject": "technology",
  "band": "canonical-5-7-8",
  "grade": 7,
  "grade_dir": "grade-07",
  "unit_number": 6,
  "unit_title": "Human-Centered and AI-Aware Design",
  "task_type": "programming_and_logic",
  "task_label": "Programming and logic task",
  "essential_question": "How can understanding human-centered and ai-aware design help us explain, decide, create, or solve something that matters?",
  "standards": [
    "Michigan Computer Science: Impacts of Computing",
    "Algorithms and Programming"
  ],
  "estimated_days": 6,
  "project_brief": "Design and test a tool or workflow that uses no AI or uses AI transparently with human verification. This is the grade 7 culminating project for \"Human-Centered and AI-Aware Design\" (ma-g7-technology-u06, unit 6), built around user research without private data, requirements, prototype testing, bias and accessibility, and AI capabilities and limits. Design and test a tool or workflow that uses no AI or uses AI transparently with human verification. As you build this, trace through your logic by hand for at least one representative input or scenario before you run or finalize it, so you can compare your prediction with the actual result.",
  "requirements": [
    "Address every topic listed for this unit: user research without private data, requirements, prototype testing, bias and accessibility, AI capabilities and limits, and iteration and documentation.",
    "Meet the performance task as written: Design and test a tool or workflow that uses no AI or uses AI transparently with human verification.",
    "Show your work or process, not just a final result — a process note, sketch log, commit history, or draft trail.",
    "Complete the checklist in this package before submitting."
  ],
  "primary_task": "Design and test a tool or workflow that uses no AI or uses AI transparently with human verification. As you build this, trace through your logic by hand for at least one representative input or scenario before you run or finalize it, so you can compare your prediction with the actual result.",
  "test_or_check_criteria": [
    "Every claim or design choice in the submission can be traced to user research without private data or another named topic from this unit — nothing is left unexplained.",
    "The submission runs, displays, or demonstrates correctly on at least two different sample inputs or scenarios the student chooses.",
    "No real password, API key, account credential, precise location, or other real personal/system data appears anywhere in the submission — fictional or sandbox examples only.",
    "The student can explain, in their own words, why each step or decision was made, not just that it works.",
    "The algorithm or program handles at least one edge case (empty input, zero, an unexpected choice) without crashing or giving a wrong answer silently."
  ],
  "presentation_and_privacy": {
    "sandbox_and_credentials_note": "This project never touches a real account, a real password or API key, a live production system, or another person's real data. Use fictional names, sandbox environments, local files, or already-approved sample data throughout. Submit code, screenshots of your own sandbox, diagrams, or a written walkthrough — a live public deployment is never required."
  },
  "copyright_and_authorship": "The final submitted work must remain your own authorship. A parent, tutor, or AI assistant may help you plan, explain a concept, demonstrate a technique, or give feedback on a draft, but may not produce the graded work itself. Never request, store, or submit a real password, API key, access token, or other real credential; use only fictional accounts and sandboxed or offline systems.",
  "remediation": "If the project stalls, step back to the smallest version of the task: rebuild just the part covering user research without private data in isolation, using a worked example from this unit as a model, then re-attach it to the full project once that smaller piece works and you can explain why.",
  "extension": "Once the core project is working, extend it to handle a new constraint or edge case related to requirements, or compare two different approaches to the same problem and explain the real tradeoff between them in your own words."
}
